971,1,பொருட்பால்,குடியியல்,பெருமை, ஒளிஒருவற்  குள்ள வெறுக்கை இளிஒருவற் அஃதிறந்து வாழ்தும் எனல்
972,2,பொருட்பால்,குடியியல்,பெருமை, பிறப்பொக்கும் எல்லா உயிர்க்கும் சிறப்பொவ்வா செய்தொழில் வேற்றுமை யான்
973,3,பொருட்பால்,குடியியல்,பெருமை, மேலிருந்தும் மேலல்லார் மேலல்லர் கீழிருந்தும் கீழல்லார் கீழல் லவர்
974,4,பொருட்பால்,குடியியல்,பெருமை, ஒருமை மகளிரே போலப் பெருமையும் தன்னைத்தான் கொண்டொழுகின் உண்டு
975,5,பொருட்பால்,குடியியல்,பெருமை, பெருமை யுடையவர் ஆற்றுவார் ஆற்றின் அருமை உடைய செயல்
976,6,பொருட்பால்,குடியியல்,பெருமை, சிறியார் உணர்ச்சியுள் இல்லை பெரியாரைப்  பேணிக்கொள் வோம்எனும் நோக்கு
977,7,பொருட்பால்,குடியியல்,பெருமை, சிறப்பே புரிந்த தொழிற்றாம் சிறப்புந்தான்  சீரல் லவர்கண் படின்
978,8,பொருட்பால்,குடியியல்,பெருமை, பணியுமாம் என்றும் பெருமை சிறுமை  அணியுமாம் தன்னை வியந்து
979,9,பொருட்பால்,குடியியல்,பெருமை, பெருமை பெருமிதம் இன்மை சிறுமை பெருமிதம் ஊர்ந்து விடல்
980,10,பொருட்பால்,குடியியல்,பெருமை, அற்றம் மறைக்கும் பெருமை சிறுமைதான் குற்றமே கூறி விடும்
981,1,பொருட்பால்,குடியியல்,சான்றாண்மை, கடன்என்ப நல்லவை எல்லாம் கடன்அறிந்து சான்றாண்மை மேற்கொள் பவர்க்கு
982,2,பொருட்பால்,குடியியல்,சான்றாண்மை, குணநலம் சான்றோர் நலனே பிறநலம் எந்நலத்து உள்ளதூஉம் அன்று
983,3,பொருட்பால்,குடியியல்,சான்றாண்மை, அன்புநாண் ஒப்புரவு கண்ணோட்டம் வாய்மையொடு ஐந்துசால் ஊன்றிய தூண்
984,4,பொருட்பால்,குடியியல்,சான்றாண்மை, கொல்லா நலத்தது நோன்மை பிறர்தீமை சொல்லா நலத்தது சால்பு
985,5,பொருட்பால்,குடியியல்,சான்றாண்மை, ஆற்றுவார் ஆற்றல் பணிதல் அதுசான்றோர்  மாற்றாரை மாற்றும் படை
986,6,பொருட்பால்,குடியியல்,சான்றாண்மை, சால்பிற்குக் கட்டளை யாதெனின் தோல்வி  துலையல்லார் கண்ணும் கொளல்
987,7,பொருட்பால்,குடியியல்,சான்றாண்மை, இன்னாசெய் தார்க்கும் இனியவே செய்யாக்கால்  என்ன பயத்ததோ சால்பு
988,8,பொருட்பால்,குடியியல்,சான்றாண்மை, இன்மை ஒருவற்கு இளிவன்று சால்பென்னும் திண்மைஉண் டாகப் பெறின்
989,9,பொருட்பால்,குடியியல்,சான்றாண்மை, ஊழி பெயரினும் தாம்பெயரார் சான்றாண்மைக்  ஆழி எனப்படு வார்
990,10,பொருட்பால்,குடியியல்,சான்றாண்மை, சான்றவர் சான்றாண்மை குன்றின் இருநிலந்தான்  தாங்காது மன்னோ பொறை
991,1,பொருட்பால்,குடியியல்,பண்புடைமை, எண்பதத்தால் எய்தல் எளிதென்ப யார்மாட்டும் பண்புடைமை என்னும் வழக்கு
992,2,பொருட்பால்,குடியியல்,பண்புடைமை, அன்புடைமை ஆன்ற குடிப்பிறத்தல் இவ்விரண்டும் பண்புடைமை என்னும் வழக்கு
993,3,பொருட்பால்,குடியியல்,பண்புடைமை, உறுப்பொத்தல் மக்களொப்பு அன்றால் வெறுத்தக்க பண்பொத்தல் ஒப்பதாம் ஒப்பு
994,4,பொருட்பால்,குடியியல்,பண்புடைமை, நயனொடு நன்றி புரிந்த பயனுடையார் பண்புபா ராட்டும் உலகு
995,5,பொருட்பால்,குடியியல்,பண்புடைமை, நகையுள்ளும் இன்னா திகழ்ச்சி பகையுள்ளும் பண்புள பாடறிவார் மாட்டு
996,6,பொருட்பால்,குடியியல்,பண்புடைமை, பண்புடையார்ப் பட்டுண்டு உலகம் அதுஇன்றேல் மண்புக்கு மாய்வது மன்
997,7,பொருட்பால்,குடியியல்,பண்புடைமை, அரம்போலும் கூர்மைய ரேனும் மரம்போல்வர் மக்கட்பண் பில்லா தவர்
998,8,பொருட்பால்,குடியியல்,பண்புடைமை, நண்பாற்றார் ஆகி நயமில செய்வார்க்கும் பண்பாற்றார் ஆதல் கடை
999,9,பொருட்பால்,குடியியல்,பண்புடைமை, நகல்வல்லர் அல்லார்க்கு மாயிரு ஞாலம் பகலும்பாற் பட்டன்று இருள்
1000,10,பொருட்பால்,குடியியல்,பண்புடைமை, பண்பிலான் பெற்ற பெருஞ்செல்வம் நன்பால்  கலந்தீமை யால்திரிந் தற்று
1001,1,பொருட்பால்,குடியியல்,நன்றியில்செல்வம், வைத்தான்வாய் சான்ற பெரும்பொருள் அஃதுண்ணான் செத்தான் செயக்கிடந்த தில்
1002,2,பொருட்பால்,குடியியல்,நன்றியில்செல்வம்,பொருளானாம் எல்லாமென்  றீயா  திவறும்  மருளானாம் மாணாப் பிறப்பு
1003,3,பொருட்பால்,குடியியல்,நன்றியில்செல்வம், ஈட்டம் இவறி இசைவேண்டா ஆடவர் தோற்றம் நிலக்குப் பொறை
1004,4,பொருட்பால்,குடியியல்,நன்றியில்செல்வம், எச்சமென்று என்எண்ணுங் கொல்லோ ஒருவரால் நச்சப் படாஅ தவன்
1005,5,பொருட்பால்,குடியியல்,நன்றியில்செல்வம், கொடுப்பதூஉம் துய்ப்பதூஉம் இல்லார்க்கு அடுக்கிய கோடியுண் டாயினும் இல்
1006,6,பொருட்பால்,குடியியல்,நன்றியில்செல்வம், ஏதம் பெருஞ்செல்வம் தான்துவ்வான் தக்கார்க்கொன் ஈதல் இயல்பிலா தான்
1007,7,பொருட்பால்,குடியியல்,நன்றியில்செல்வம், அற்றார்க்கொன் றாற்றாதான் செல்வம் மிகநலம் பெற்றாள் தமியள்மூத் தற்று
1008,8,பொருட்பால்,குடியியல்,நன்றியில்செல்வம், நச்சப் படாதவன் செல்வம் நடுவூருள்  நச்சு மரம்பழுத் தற்று
1009,9,பொருட்பால்,குடியியல்,நன்றியில்செல்வம், அன்பொரீஇத் தற்செற் றறநோக்கா தீட்டிய  ஒண்பொருள் கொள்வார் பிறர்
1010,10,பொருட்பால்,குடியியல்,நன்றியில்செல்வம், சீருடைச் செல்வர் சிறுதுனி மார  வறங்கூர்ந் தனையது உடைத்து
1011,1,பொருட்பால்,குடியியல்,நாணுடைமை, கருமத்தால் நாணுதல் நாணுந் திருநுதல்  நல்லவர் நாணுப் பிற
1012,2,பொருட்பால்,குடியியல்,நாணுடைமை, ஊணுடை எச்சம் உயிர்க்கெல்லாம் வேறல்ல  நாணுடைமை மாந்தர் சிறப்பு
1013,3,பொருட்பால்,குடியியல்,நாணுடைமை, ஊனைக் குறித்த உயிரெல்லாம் நாண்என்னும் நன்மை குறித்தது சால்பு
1014,4,பொருட்பால்,குடியியல்,நாணுடைமை, அணிஅன்றோ நாணுடைமை சான்றோர்க்கு அஃதின்றேல் பிணிஅன்றோ பீடு நடை
1015,5,பொருட்பால்,குடியியல்,நாணுடைமை, பிறர்பழியும் தம்பழியும் நாணுவார் நாணுக்கு உறைபதி என்னும் உலகு
1016,6,பொருட்பால்,குடியியல்,நாணுடைமை, நாண்வேலி கொள்ளாது மன்னோ வியன்ஞாலம் பேணலர் மேலா யவர்
1017,7,பொருட்பால்,குடியியல்,நாணுடைமை, நாணால் உயிரைத் துறப்பர் உயிர்ப்பொருட்டால்  நாண்துறவார் நாணாள் பவர்
1018,8,பொருட்பால்,குடியியல்,நாணுடைமை, பிறர்நாணத் தக்கது தான்நாணா னாயின்  அறம்நாணத் தக்கது உடைத்து
1019,9,பொருட்பால்,குடியியல்,நாணுடைமை, குலஞ்சுடும் கொள்கை பிழைப்பின் நலஞ்சுடும்  நாணின்மை நின்றக் கடை
1020,10,பொருட்பால்,குடியியல்,நாணுடைமை, நாண்அகத் தில்லார் இயக்கம் மரப்பாவை  நாணால் உயிர்மருட்டி அற்று
1021,1,பொருட்பால்,குடியியல்,குடிசெயல்வகை, கருமம் செயஒருவன் கைதூவேன் என்னும்  பெருமையில் பீடுடைய தில்
1022,2,பொருட்பால்,குடியியல்,குடிசெயல்வகை, ஆள்வினையும் ஆன்ற அறிவும் எனஇரண்டின்  நீள்வினையான் நீளும் குடி
1023,3,பொருட்பால்,குடியியல்,குடிசெயல்வகை, குடிசெய்வல் என்னும் ஒருவற்குத் தெய்வம்  மடிதற்றுத் தான்முந் துறும்
1024,4,பொருட்பால்,குடியியல்,குடிசெயல்வகை, சூழாமல் தானே முடிவெய்தும் தம்குடியைத்  தாழாது உஞற்று பவர்க்கு
1025,5,பொருட்பால்,குடியியல்,குடிசெயல்வகை, குற்றம் இலனாய்க் குடிசெய்து வாழ்வானைச்  சுற்றமாச் சுற்றும் உலகு
1026,6,பொருட்பால்,குடியியல்,குடிசெயல்வகை, நல்லாண்மை என்பது ஒருவற்குத் தான்பிறந்த  இல்லாண்மை ஆக்கிக் கொளல்
1027,7,பொருட்பால்,குடியியல்,குடிசெயல்வகை, அமரகத்து வன்கண்ணர் போலத் தமரகத்தும்  ஆற்றுவார் மேற்றே பொறை
1028,8,பொருட்பால்,குடியியல்,குடிசெயல்வகை, குடிசெய்வார்க் கில்லை பருவம் மடிசெய்து  மானங் கருதக் கெடும்
1029,9,பொருட்பால்,குடியியல்,குடிசெயல்வகை, இடும்பைக்கே கொள்கலம் கொல்லோ குடும்பத்தைக்  குற்ற மறைப்பான் உடம்பு
1030,10,பொருட்பால்,குடியியல்,குடிசெயல்வகை, இடுக்கண்கால் கொன்றிட வீழும் அடுத்தூன்றும்  நல்லாள் இலாத குடி
1031,1,பொருட்பால்,குடியியல்,உழவு, சுழன்றும்ஏர்ப் பின்னது உலகம் அதனால்  உழந்தும் உழவே தலை
1032,2,பொருட்பால்,குடியியல்,உழவு, உழுவார் உலகத்தார்க் காணிஅஃ தாற்றா  எழுவாரை எல்லாம் பொறுத்து
1033,3,பொருட்பால்,குடியியல்,உழவு, உழுதுண்டு வாழ்வாரே வாழ்வார்மற் றெல்லாம்  தொழுதுண்டு பின்செல் பவர்
1034,4,பொருட்பால்,குடியியல்,உழவு, பலகுடை நீழலும் தங்குடைக்கீழ்க் காண்பர்  அலகுடை நீழ லவர்
1035,5,பொருட்பால்,குடியியல்,உழவு, இரவார் இரப்பார்க்கொன் றீவர் கரவாது  கைசெய்தூண் மாலை யவர்
1036,6,பொருட்பால்,குடியியல்,உழவு, உழவினார் கைம்மடங்கின் இல்லை விழைவதூஉம்  விட்டேம்என் பார்க்கும் நிலை
1037,7,பொருட்பால்,குடியியல்,உழவு, தொடிப்புழுதி கஃசா உணக்கின் பிடித்தெருவும்  வேண்டாது சாலப் படும்
1038,8,பொருட்பால்,குடியியல்,உழவு, ஏரினும் நன்றால் எருவிடுதல் கட்டபின்  நீரினும் நன்றதன் காப்பு
1039,9,பொருட்பால்,குடியியல்,உழவு, செல்லான் கிழவன் இருப்பின் நிலம்புலந்து  இல்லாளின் ஊடி விடும்
1040,10,பொருட்பால்,குடியியல்,உழவு, இலமென்று அசைஇ இருப்பாரைக் காணின்  நிலமென்னும் நல்லாள் நகும்
1041,1,பொருட்பால்,குடியியல்,நல்குரவு, இன்மையின் இன்னாத தியாதெனின் இன்மையின்  இன்மையே இன்னா தது
1042,2,பொருட்பால்,குடியியல்,நல்குரவு, இன்மை எனவொரு பாவி மறுமையும்  இம்மையும் இன்றி வரும்
1043,3,பொருட்பால்,குடியியல்,நல்குரவு, தொல்வரவும் தோலும் கெடுக்கும் தொகையாக  நல்குரவு என்னும் நசை
1044,4,பொருட்பால்,குடியியல்,நல்குரவு, இற்பிறந்தார் கண்ணேயும் இன்மை இளிவந்த  சொற்பிறக்கும் சோர்வு தரும்
1045,5,பொருட்பால்,குடியியல்,நல்குரவு, நல்குரவு என்னும் இடும்பையுள் பல்குரைத்  துன்பங்கள் சென்று படும்
1046,6,பொருட்பால்,குடியியல்,நல்குரவு, நற்பொருள் நன்குணர்ந்து சொல்லினும் நல்கூர்ந்தார்  சொற்பொருள் சோர்வு படும்
1047,7,பொருட்பால்,குடியியல்,நல்குரவு, அறஞ்சாரா நல்குரவு ஈன்றதா யானும்  பிறன்போல நோக்கப் படும்
1048,8,பொருட்பால்,குடியியல்,நல்குரவு, இன்றும் வருவது கொல்லோ நெருநலும்  கொன்றது போலும் நிரப்பு
1049,9,பொருட்பால்,குடியியல்,நல்குரவு, நெருப்பினுள் துஞ்சலும் ஆகும் நிரப்பினுள்  யாதொன்றும் கண்பாடு அரிது
1050,10,பொருட்பால்,குடியியல்,நல்குரவு, துப்புர வில்லார் துவரத் துறவாமை  உப்பிற்கும் காடிக்கும் கூற்று
1051,1,பொருட்பால்,குடியியல்,இரவு, இரக்க இரத்தக்கார்க் காணின் கரப்பின்  அவர்பழி தம்பழி அன்று
1052,2,பொருட்பால்,குடியியல்,இரவு, இன்பம் ஒருவற்கு இரத்தல் இரந்தவை  துன்பம் உறாஅ வரின்
1053,3,பொருட்பால்,குடியியல்,இரவு, கரப்பிலா நெஞ்சின் கடனறிவார் முன்நின்று  இரப்புமோ ரேஎர் உடைத்து
1054,4,பொருட்பால்,குடியியல்,இரவு, இரத்தலும் ஈதலே போலும் கரத்தல்  கனவிலும் தேற்றாதார் மாட்டு
1055,5,பொருட்பால்,குடியியல்,இரவு, கரப்பிலார் வையகத்து உண்மையால் கண்ணின்று  இரப்பவர் மேற்கொள் வது
1056,6,பொருட்பால்,குடியியல்,இரவு, கரப்பிடும்பை யில்லாரைக் காணின் நிரப்பிடும்பை  எல்லாம் ஒருங்கு கெடும்
1057,7,பொருட்பால்,குடியியல்,இரவு, இகழ்ந்தெள்ளா தீவாரைக் காணின் மகிழ்ந்துள்ளம்  உள்ளுள் உவப்ப துடைத்து
1058,8,பொருட்பால்,குடியியல்,இரவு, இரப்பாரை இல்லாயின் ஈர்ங்கண்மா ஞாலம்  மரப்பாவை சென்றுவந் தற்று
1059,9,பொருட்பால்,குடியியல்,இரவு, ஈவார்கண் என்னுண்டாம் தோற்றம் இரந்துகோள்  மேவார் இலாஅக் கடை
1060,10,பொருட்பால்,குடியியல்,இரவு, இரப்பான் வெகுளாமை வேண்டும் நிரப்பிடும்பை  தானேயும் சாலும் கரி
1061,1,பொருட்பால்,குடியியல்,இரவச்சம், கரவாது உவந்தீயும் கண்ணன்னார் கண்ணும்  இரவாமை கோடி உறும்
1062,2,பொருட்பால்,குடியியல்,இரவச்சம், இரந்தும் உயிர்வாழ்தல் வேண்டின் பரந்து  கெடுக உலகியற்றி யான்
1063,3,பொருட்பால்,குடியியல்,இரவச்சம், இன்மை இடும்பை இரந்துதீர் வாமென்னும்  வன்மையின் வன்பாட்ட தில்
1064,4,பொருட்பால்,குடியியல்,இரவச்சம், இடமெல்லாம் கொள்ளாத் தகைத்தே இடமில்லாக்  காலும் இரவொல்லாச் சால்பு
1065,5,பொருட்பால்,குடியியல்,இரவச்சம், தெண்ணீர் அடுபுற்கை யாயினும் தாள்தந்த  உண்ணலின் ஊங்கினிய தில்
1066,6,பொருட்பால்,குடியியல்,இரவச்சம், ஆவிற்கு நீரென்று இரப்பினும் நாவிற்கு  இரவின் இளிவந்த தில்
1067,7,பொருட்பால்,குடியியல்,இரவச்சம், இரப்பன் இரப்பாரை எல்லாம் இரப்பின்  கரப்பார் இரவன்மின் என்று
1068,8,பொருட்பால்,குடியியல்,இரவச்சம், இரவென்னும் ஏமாப்பில் தோணி கரவென்னும்  பார்தாக்கப் பக்கு விடும்
1069,9,பொருட்பால்,குடியியல்,இரவச்சம், இரவுள்ள உள்ளம் உருகும் கரவுள்ள  உள்ளதூஉம் இன்றிக் கெடும்
