576,6,பொருட்பால்,அரசியல்,கண்ணோட்டம், மண்ணோ டியைந்த மரத்தனையர் கண்ணோடு இயைந்துகண் ணோடா தவர்
577,7,பொருட்பால்,அரசியல்,கண்ணோட்டம், கண்ணோட்டம் இல்லவர் கண்ணிலர் கண்ணுடையார் கண்ணோட்டம் இன்மையும் இல்
578,8,பொருட்பால்,அரசியல்,கண்ணோட்டம், கருமஞ் சிதையாமற் கண்ணோட வல்லார்க் குரிமை உடைத்திவ் வுலகு
579,9,பொருட்பால்,அரசியல்,கண்ணோட்டம், ஒறுத்தாற்றும் பண்பினார் கண்ணுங்கண் ணோடிப் பொறுத்தாற்றும் பண்பே தலை
580,10,பொருட்பால்,அரசியல்,கண்ணோட்டம், பெயக்கண்டு நஞ்சுண் டமைவர் நயத்தக்க நாகரிகம் வேண்டு பவர்
581,1,பொருட்பால்,அரசியல்,ஒற்றாடல், ஒற்றும் உரைசான்ற நூலும் இவையிரண்டும் தெற்றென்க மன்னவன் கண்
582,2,பொருட்பால்,அரசியல்,ஒற்றாடல், எல்லார்க்கும் எல்லாம் நிகழ்பவை எஞ்ஞான்றும் வல்லறிதல் வேந்தன் தொழில்
583,3,பொருட்பால்,அரசியல்,ஒற்றாடல், ஒற்றினான் ஒற்றிப் பொருள்தெரியா மன்னவன் கொற்றங் கொளக்கிடந்த தில்
584,4,பொருட்பால்,அரசியல்,ஒற்றாடல், வினைசெய்வார் தஞ்சுற்றம் வேண்டாதா ரென்றாங் கனைவரையும் ஆராய்வ தொற்று
585,5,பொருட்பால்,அரசியல்,ஒற்றாடல், கடாஅ உருவொடு கண்ணஞ்சா தியாண்டும் உகாஅமை வல்லதே ஒற்று
586,6,பொருட்பால்,அரசியல்,ஒற்றாடல், துறந்தார் படிவத்த ராகி இறந்தாராய்ந் தென்செயினுஞ் சோர்வில தொற்று
587,7,பொருட்பால்,அரசியல்,ஒற்றாடல், மறைந்தவை கேட்கவற் றாகி அறிந்தவை ஐயப்பா டில்லதே ஒற்று
588,8,பொருட்பால்,அரசியல்,ஒற்றாடல், ஒற்றொற்றித் தந்த பொருளையும் மற்றுமோர் ஒற்றினால் ஒற்றிக் கொளல்
589,9,பொருட்பால்,அரசியல்,ஒற்றாடல், ஒற்றொற் றுணராமை யாள்க உடன்மூவர் சொற்றொக்க தேறப் படும்
590,10,பொருட்பால்,அரசியல்,ஒற்றாடல், சிறப்பறிய ஒற்றின்கண் செய்யற்க செய்யிற் புறப்படுத்தான் ஆகும் மறை
591,1,பொருட்பால்,அரசியல்,ஊக்கமுடைமை, உடையர் எனப்படுவ தூக்கமஃ தில்லார் உடைய துடையரோ மற்று
592,2,பொருட்பால்,அரசியல்,ஊக்கமுடைமை, உள்ள முடைமை உடைமை பொருளுடைமை நில்லாது நீங்கி விடும்
593,3,பொருட்பால்,அரசியல்,ஊக்கமுடைமை, ஆக்கம் இழந்தேமென் றல்லாவார் ஊக்கம் ஒருவந்தங் கைத்துடை யார்
594,4,பொருட்பால்,அரசியல்,ஊக்கமுடைமை, ஆக்கம் அதர்வினாய்ச் செல்லும் அசைவிலா ஊக்க முடையா னுழை
595,5,பொருட்பால்,அரசியல்,ஊக்கமுடைமை, வெள்ளத் தனைய மலர்நீட்டம் மாந்தர்தம் உள்ளத் தனைய துயர்வு
596,6,பொருட்பால்,அரசியல்,ஊக்கமுடைமை, உள்ளுவ தெல்லாம் உயர்வுள்ளல் மற்றது தள்ளினுந் தள்ளாமை நீர்த்து
597,7,பொருட்பால்,அரசியல்,ஊக்கமுடைமை, சிதைவிடத் தொல்கார் உரவோர் புதையம்பிற் பட்டுப்பா டூன்றுங் களிறு
598,8,பொருட்பால்,அரசியல்,ஊக்கமுடைமை, உள்ளம் இலாதவர் எய்தார் உலகத்து வள்ளியம் என்னுஞ் செருக்கு
599,9,பொருட்பால்,அரசியல்,ஊக்கமுடைமை, பரியது கூர்ங்கோட்ட தாயினும் யானை வெரூஉம் புலிதாக் குறின்
600,10,பொருட்பால்,அரசியல்,ஊக்கமுடைமை, உரமொருவற் குள்ள வெறுக்கையஃ தில்லார் மரமக்க ளாதலே வேறு
601,1,பொருட்பால்,அரசியல்,மடியின்மை, குடியென்னுங் குன்றா விளக்கம் மடியென்னும் மாசூர மாய்ந்து கெடும்
602,2,பொருட்பால்,அரசியல்,மடியின்மை, மடியை மடியா ஒழுகல் குடியைக் குடியாக வேண்டு பவர்
603,3,பொருட்பால்,அரசியல்,மடியின்மை, மடிமடிக் கொண்டொழுகும் பேதை பிறந்த குடிமடியுந் தன்னினு முந்து
604,4,பொருட்பால்,அரசியல்,மடியின்மை, குடிமடிந்து குற்றம் பெருகும் மடிமடிந்து மாண்ட உஞற்றி லவர்க்கு
605,5,பொருட்பால்,அரசியல்,மடியின்மை, நெடுநீர் மறவி மடிதுயில் நான்கும் கெடுநீரார் காமக் கலன்
606,6,பொருட்பால்,அரசியல்,மடியின்மை, படியுடையார் பற்றமைந்தக் கண்ணும் மடியுடையார் மாண்பயன் எய்தல் அரிது
607,7,பொருட்பால்,அரசியல்,மடியின்மை, இடிபுரிந் தெள்ளுஞ்சொற் கேட்பர் மடிபுரிந்து மாண்ட உஞற்றி லவர்
608,8,பொருட்பால்,அரசியல்,மடியின்மை, மடிமை குடிமைக்கண் தங்கிற்றன் னென்னார்க் கடிமை புகுத்தி விடும்
609,9,பொருட்பால்,அரசியல்,மடியின்மை, குடியாண்மை யுள்வந்த குற்றம் ஒருவன் மடியாண்மை மாற்றக் கெடும்
610,10,பொருட்பால்,அரசியல்,மடியின்மை, மடியிலா மன்னவன் எய்தும் அடியளந்தான் தாஅய தெல்லாம் ஒருங்கு
611,1,பொருட்பால்,அரசியல்,ஆள்வினையுடைமை, அருமை உடைத்தென் றசாவாமை வேண்டும் பெருமை முயற்சி தரும்
612,2,பொருட்பால்,அரசியல்,ஆள்வினையுடைமை, வினைக்கண் வினைகெடல் ஓம்பல் வினைக்குறை தீர்ந்தாரின் தீர்ந்தன் றுலகு
613,3,பொருட்பால்,அரசியல்,ஆள்வினையுடைமை, தாளாண்மை என்னுந் தகைமைக்கண் தங்கிற்றே வேளாண்மை என்னுஞ் செருக்கு
614,4,பொருட்பால்,அரசியல்,ஆள்வினையுடைமை, தாளாண்மை இல்லாதான் வேளாண்மை பேடிகை வாளாண்மை போலக் கெடும்
615,5,பொருட்பால்,அரசியல்,ஆள்வினையுடைமை, இன்பம் விழையான் வினைவிழைவான் தன்கேளிர் துன்பம் துடைத்தூன்றும் தூண்
616,6,பொருட்பால்,அரசியல்,ஆள்வினையுடைமை, முயற்சி திருவினை ஆக்கும் முயற்றின்மை இன்மை புகுத்தி விடும்
617,7,பொருட்பால்,அரசியல்,ஆள்வினையுடைமை, மடியுளாள் மாமுகடி என்ப மடியிலான் தாளுளாள் தாமரையி னாள்
618,8,பொருட்பால்,அரசியல்,ஆள்வினையுடைமை, பொறியின்மை யார்க்கும் பழியன் றறிவறிந் தாள்வினை இன்மை பழி
619,9,பொருட்பால்,அரசியல்,ஆள்வினையுடைமை, தெய்வத்தான் ஆகா தெனினும் முயற்சிதன் மெய்வருத்தக் கூலி தரும்
620,10,பொருட்பால்,அரசியல்,ஆள்வினையுடைமை, ஊழையும் உப்பக்கங் காண்பர் உலைவின்றித் தாழா துஞற்று பவர்
621,1,பொருட்பால்,அரசியல்,இடுக்கணழியாமை, இடுக்கண் வருங்கால் நகுக அதனை அடுத்தூர்வ தஃதொப்ப தில்
622,2,பொருட்பால்,அரசியல்,இடுக்கணழியாமை, வெள்ளத் தனைய இடும்பை அறிவுடையான் உள்ளத்தின் உள்ளக் கெடும்
623,3,பொருட்பால்,அரசியல்,இடுக்கணழியாமை, இடும்பைக் கிடும்பை படுப்பர் இடும்பைக் கிடும்பை படாஅ தவர்
624,4,பொருட்பால்,அரசியல்,இடுக்கணழியாமை, மடுத்தவா யெல்லாம் பகடன்னான் உற்ற இடுக்கண் இடர்ப்பா டுடைத்து
625,5,பொருட்பால்,அரசியல்,இடுக்கணழியாமை, அடுக்கி வரினும் அழிவிலான் உற்ற இடுக்கண் இடுக்கட் படும்
626,6,பொருட்பால்,அரசியல்,இடுக்கணழியாமை, அற்றேமென் றல்லற் படுபவோ பெற்றேமென் றோம்புதல் தேற்றா தவர்
627,7,பொருட்பால்,அரசியல்,இடுக்கணழியாமை, இலக்கம் உடம்பிடும்பைக் கென்று கலக்கத்தைக் கையாறாக் கொள்ளாதா மேல்
628,8,பொருட்பால்,அரசியல்,இடுக்கணழியாமை, இன்பம் விழையான் இடும்பை இயல்பென்பான் துன்ப முறுதல் இலன்
629,9,பொருட்பால்,அரசியல்,இடுக்கணழியாமை, இன்பத்துள் இன்பம் விழையாதான் துன்பத்துள் துன்ப முறுதல் இலன்
630,10,பொருட்பால்,அரசியல்,இடுக்கணழியாமை, இன்னாமை இன்பம் எனக்கொளின் ஆகுந்தன் ஒன்னார் விழையுஞ் சிறப்பு
631,1,பொருட்பால்,அமைச்சியல்,அமைச்சு, கருவியும் காலமும் செய்கையும் செய்யும் அருவினையும் மாண்ட தமைச்சு
632,2,பொருட்பால்,அமைச்சியல்,அமைச்சு, வன்கண் குடிகாத்தல் கற்றறிதல் ஆள்வினையோ டைந்துடன் மாண்ட தமைச்சு
633,3,பொருட்பால்,அமைச்சியல்,அமைச்சு, பிரித்தலும் பேணிக் கொளலும் பிரிந்தார்ப் பொருத்தலும் வல்ல தமைச்சு
634,4,பொருட்பால்,அமைச்சியல்,அமைச்சு, தெரிதலுந் தேர்ந்து செயலும் ஒருதலையாச் சொல்லலும் வல்ல தமைச்சு
635,5,பொருட்பால்,அமைச்சியல்,அமைச்சு, அறனறிந் தான்றமைந்த சொல்லானெஞ் ஞான்றுந் திறனறிந்தான் தேர்ச்சித் துணை
636,6,பொருட்பால்,அமைச்சியல்,அமைச்சு, மதிநுட்ப நூலோ டுடையார்க் கதிநுட்பம் யாவுள முன்னிற் பவை
637,7,பொருட்பால்,அமைச்சியல்,அமைச்சு, செயற்கை அறிந்தக் கடைத்து முலகத் தியற்கை அறிந்து செயல்
638,8,பொருட்பால்,அமைச்சியல்,அமைச்சு, அறிகொன் றறியான் எனினும் உறுதி உழையிருந்தான் கூறல் கடன்
639,9,பொருட்பால்,அமைச்சியல்,அமைச்சு, பழுதெண்ணும் மந்திரியிற் பக்கத்துள் தெவ்வோர் எழுபது கோடி உறும்
640,10,பொருட்பால்,அமைச்சியல்,அமைச்சு, முறைப்படச் சூழ்ந்து முடிவிலவே செய்வர் திறப்பா டிலாஅ தவர்
641,1,பொருட்பால்,அமைச்சியல்,சொல்வன்மை, நாநல மென்னும் நலனுடைமை அந்நலம் யாநலத் துள்ளதூஉம் அன்று
642,2,பொருட்பால்,அமைச்சியல்,சொல்வன்மை, ஆக்கமுங் கேடும் அதனால் வருதலாற் காத்தோம்பல் சொல்லின்கட் சோர்வு
643,3,பொருட்பால்,அமைச்சியல்,சொல்வன்மை, கேட்டார்ப் பிணிக்கும் தகையவாய்க் கேளாரும் வேட்ப மொழிவதாம் சொல்
644,4,பொருட்பால்,அமைச்சியல்,சொல்வன்மை, திறனறிந்து சொல்லுக சொல்லை அறனும் பொருளும் அதனினூஉங் கில்
645,5,பொருட்பால்,அமைச்சியல்,சொல்வன்மை, சொல்லுக சொல்லைப் பிறிதோர்சொல் அச்சொல்லை வெல்லுஞ்சொல் இன்மை அறிந்து
646,6,பொருட்பால்,அமைச்சியல்,சொல்வன்மை, வேட்பத்தாஞ் சொல்லிப் பிறர்சொற் பயன்கோடல் மாட்சியின் மாசற்றார் கோள்
647,7,பொருட்பால்,அமைச்சியல்,சொல்வன்மை, சொலல்வல்லன் சோர்விலன் அஞ்சா னவனை இகல்வெல்லல் யார்க்கும் அரிது
648,8,பொருட்பால்,அமைச்சியல்,சொல்வன்மை, விரைந்து தொழில்கேட்கும் ஞாலம் நிரந்தினிது சொல்லுதல் வல்லார்ப் பெறின்
649,9,பொருட்பால்,அமைச்சியல்,சொல்வன்மை, பலசொல்லக் காமுறுவர் மன்றமா சற்ற சிலசொல்லல் தேற்றா தவர்
650,10,பொருட்பால்,அமைச்சியல்,சொல்வன்மை, இணரூழ்த்து நாறா மலரனையர் கற்ற துணர விரிந்துரையா தார்
651,1,பொருட்பால்,அமைச்சியல்,வினைத்தூய்மை, துணைநலம் ஆக்கந் தரூஉம் வினைநலம் வேண்டிய எல்லாந் தரும்
652,2,பொருட்பால்,அமைச்சியல்,வினைத்தூய்மை, என்றும் ஒருவுதல் வேண்டும் புகழொடு நன்றி பயவா வினை
653,3,பொருட்பால்,அமைச்சியல்,வினைத்தூய்மை, ஓஒதல் வேண்டும் ஒளிமாழ்குஞ் செய்வினை ஆஅது மென்னு மவர்
654,4,பொருட்பால்,அமைச்சியல்,வினைத்தூய்மை, இடுக்கண் படினும் இளிவந்த செய்யார் நடுக்கற்ற காட்சி யவர்
655,5,பொருட்பால்,அமைச்சியல்,வினைத்தூய்மை, எற்றென் றிரங்குவ செய்யற்க செய்வானேல் மற்றன்ன செய்யாமை நன்று
656,6,பொருட்பால்,அமைச்சியல்,வினைத்தூய்மை, ஈன்றாள் பசிகாண்பான் ஆயினுஞ் செய்யற்க சான்றோர் பழிக்கும் வினை
657,7,பொருட்பால்,அமைச்சியல்,வினைத்தூய்மை, பழிமலைந் தெய்திய ஆக்கத்திற் சான்றோர் கழிநல் குரவே தலை
658,8,பொருட்பால்,அமைச்சியல்,வினைத்தூய்மை, கடிந்த கடிந்தொரார் செய்தார்க் கவைதாம் முடிந்தாலும் பீழை தரும்
659,9,பொருட்பால்,அமைச்சியல்,வினைத்தூய்மை, அழக்கொண்ட எல்லாம் அழப்போம் இழப்பினும் பிற்பயக்கும் நற்பா லவை
660,10,பொருட்பால்,அமைச்சியல்,வினைத்தூய்மை, சலத்தாற் பொருள்செய்தே மார்த்தல் பசுமண் கலத்துணீர் பெய்திரீஇ யற்று
661,1,பொருட்பால்,அமைச்சியல்,வினைத்திட்பம், வினைத்திட்பம் என்ப தொருவன் மனத்திட்பம் மற்றைய எல்லாம் பிற
662,2,பொருட்பால்,அமைச்சியல்,வினைத்திட்பம், ஊறொரால் உற்றபின் ஒல்காமை இவ்விரண்டின் ஆறென்பர் ஆய்ந்தவர் கோள்
663,3,பொருட்பால்,அமைச்சியல்,வினைத்திட்பம், கடைக்கொட்கச் செய்தக்க தாண்மை இடைக்கொட்கின் எற்றா விழுமந் தரும்
664,4,பொருட்பால்,அமைச்சியல்,வினைத்திட்பம், சொல்லுதல் யார்க்கும் எளிய அரியவாம் சொல்லிய வண்ணம் செயல்
665,5,பொருட்பால்,அமைச்சியல்,வினைத்திட்பம், வீறெய்தி மாண்டார் வினைத்திட்பம் வேந்தன்கண் ஊறெய்தி உள்ளப் படும்
666,6,பொருட்பால்,அமைச்சியல்,வினைத்திட்பம், எண்ணிய எண்ணியாங் கெய்துப எண்ணியார் திண்ணியர் ஆகப் பெறின்
667,7,பொருட்பால்,அமைச்சியல்,வினைத்திட்பம், உருவுகண் டெள்ளாமை வேண்டும் உருள்பெருந்தேர்க் கச்சாணி யன்னார் உடைத்து
668,8,பொருட்பால்,அமைச்சியல்,வினைத்திட்பம், கலங்காது கண்ட வினைக்கண் துளங்காது தூக்கங் கடிந்து செயல்
669,9,பொருட்பால்,அமைச்சியல்,வினைத்திட்பம், துன்பம் உறவரினும் செய்க துணிவாற்றி இன்பம் பயக்கும் வினை
670,10,பொருட்பால்,அமைச்சியல்,வினைத்திட்பம், எனைத்திட்ப மெய்தியக் கண்ணும் வினைத்திட்பம் வேண்டாரை வேண்டா துலகு
671,1,பொருட்பால்,அமைச்சியல்,வினைசெயல்வகை, சூழ்ச்சி முடிவு துணிவெய்தல் அத்துணிவு தாழ்ச்சியுள் தங்குதல் தீது
672,2,பொருட்பால்,அமைச்சியல்,வினைசெயல்வகை, தூங்குக தூங்கிச் செயற்பால தூங்கற்க தூங்காது செய்யும் வினை
673,3,பொருட்பால்,அமைச்சியல்,வினைசெயல்வகை, ஒல்லும்வா யெல்லாம் வினைநன்றே ஒல்லாக்கால் செல்லும்வாய் நோக்கிச் செயல்
674,4,பொருட்பால்,அமைச்சியல்,வினைசெயல்வகை, வினைபகை யென்றிரண்டின் எச்சம் நினையுங்கால் தீயெச்சம் போலத் தெறும்
