279,9,அறத்துப்பால்,துறவறவியல்,கூடாவொழுக்கம், கணைகொடிது யாழ்கோடு செவ்விதுஆங் கன்ன வினைபடு பாலால் கொளல்
280,10,அறத்துப்பால்,துறவறவியல்,கூடாவொழுக்கம், மழித்தலும் நீட்டலும் வேண்டா உலகம் பழித்த தொழித்து விடின்
281,1,அறத்துப்பால்,துறவறவியல்,கள்ளாமை, எள்ளாமை வேண்டுவா னென்பான் எனைத்தொன்றுங் கள்ளாமை காக்கதன் நெஞ்சு
282,2,அறத்துப்பால்,துறவறவியல்,கள்ளாமை, உள்ளத்தால் உள்ளலுந் தீதே பிறன்பொருளைக் கள்ளத்தால் கள்வே மெனல்
283,3,அறத்துப்பால்,துறவறவியல்,கள்ளாமை, களவினா லாகிய ஆக்கம் அளவிறந் தாவது போலக் கெடும்
284,4,அறத்துப்பால்,துறவறவியல்,கள்ளாமை, களவின்கண் கன்றிய காதல் விளைவின்கண் வீயா விழுமந் தரும்
285,5,அறத்துப்பால்,துறவறவியல்,கள்ளாமை, அருள்கருதி அன்புடைய ராதல் பொருள்கருதிப் பொச்சாப்புப் பார்ப்பார்க ணில்
286,6,அறத்துப்பால்,துறவறவியல்,கள்ளாமை, அளவின்கண் நின்றொழுக லாற்றார் களவின்கண் கன்றிய காத லவர்
287,7,அறத்துப்பால்,துறவறவியல்,கள்ளாமை, களவென்னுங் காரறி வாண்மை அளவென்னும் ஆற்றல் புரிந்தார்க ணில்
288,8,அறத்துப்பால்,துறவறவியல்,கள்ளாமை, அளவறிந்தார் நெஞ்சத் தறம்போல நிற்குங் களவறிந்தார் நெஞ்சில் கரவு
289,9,அறத்துப்பால்,துறவறவியல்,கள்ளாமை, அளவல்ல செய்தாங்கே வீவர் களவல்ல மற்றைய தேற்றா தவர்
290,10,அறத்துப்பால்,துறவறவியல்,கள்ளாமை, கள்வார்க்குத் தள்ளும் உயிர்நிலை கள்ளார்க்குத் தள்ளாது புத்தே ளுலகு
291,1,அறத்துப்பால்,துறவறவியல்,வாய்மை, வாய்மை எனப்படுவ தியாதெனின் யாதொன்றந் தீமை யிலாத சொலல்
292,2,அறத்துப்பால்,துறவறவியல்,வாய்மை, பொய்ம்மையும் வாய்மை யிடத்த புரைதீர்ந்த நன்மை பயக்கு மெனின்
293,3,அறத்துப்பால்,துறவறவியல்,வாய்மை, தன்நெஞ் சறிவது பொய்யற்க பொய்த்தபின் தன்நெஞ்சே தன்னைச் சுடும்
294,4,அறத்துப்பால்,துறவறவியல்,வாய்மை, உள்ளத்தாற் பொய்யா தொழுகின் உலகத்தார் உள்ளத்து ளெல்லாம் உளன்
295,5,அறத்துப்பால்,துறவறவியல்,வாய்மை, மனத்தொடு வாய்மை மொழியின் தவத்தொடு தானஞ்செய் வாரின் தலை
296,6,அறத்துப்பால்,துறவறவியல்,வாய்மை, பொய்யாமை யன்ன புகழில்லை எய்யாமை எல்லா அறமுந் தரும்
297,7,அறத்துப்பால்,துறவறவியல்,வாய்மை, பொய்யாமை பொய்யாமை ஆற்றின் அறம்பிற செய்யாமை செய்யாமை நன்று
298,8,அறத்துப்பால்,துறவறவியல்,வாய்மை, புறந்தூய்மை நீரா னமையும் அகந்தூய்மை வாய்மையால் காணப் படும்
299,9,அறத்துப்பால்,துறவறவியல்,வாய்மை, எல்லா விளக்கும் விளக்கல்ல சான்றோர்க்குப் பொய்யா விளக்கே விளக்கு
300,10,அறத்துப்பால்,துறவறவியல்,வாய்மை, யாமெய்யாக் கண்டவற்று ளில்லை எனைத்தொன்றும் வாய்மையின் நல்ல பிற
301,1,அறத்துப்பால்,துறவறவியல்,வெகுளாமை, செல்லிடத்துக் காப்பான் சினங்காப்பான் அல்லிடத்துக் காக்கினென் காவாக்கா லென்
302,2,அறத்துப்பால்,துறவறவியல்,வெகுளாமை, செல்லா இடத்துச் சினந்தீது செல்லிடத்தும் இல்லதனின் தீய பிற
303,3,அறத்துப்பால்,துறவறவியல்,வெகுளாமை, மறத்தல் வெகுளியை யார்மாட்டுந் தீய பிறத்தல் அதனான் வரும்
304,4,அறத்துப்பால்,துறவறவியல்,வெகுளாமை, நகையும் உவகையுங் கொல்லுஞ் சினத்தின் பகையும் உளவோ பிற
305,5,அறத்துப்பால்,துறவறவியல்,வெகுளாமை, தன்னைத்தான் காக்கின் சினங்காக்க காவாக்கால் தன்னையே கொல்லுஞ் சினம்
306,6,அறத்துப்பால்,துறவறவியல்,வெகுளாமை, சினமென்னுஞ் சேர்ந்தாரைக் கொல்லி இனமென்னும் ஏமப் புணையைச் சுடும்
307,7,அறத்துப்பால்,துறவறவியல்,வெகுளாமை, சினத்தைப் பொருளென்று கொண்டவன் கேடு நிலத்தறைந்தான் கைபிழையா தற்று
308,8,அறத்துப்பால்,துறவறவியல்,வெகுளாமை, இணரெரி தோய்வன்ன இன்னா செயினும் புணரின் வெகுளாமை நன்று
309,9,அறத்துப்பால்,துறவறவியல்,வெகுளாமை, உள்ளிய தெல்லாம் உடனெய்தும் உள்ளத்தால் உள்ளான் வெகுளி யெனின்
310,10,அறத்துப்பால்,துறவறவியல்,வெகுளாமை, இறந்தார் இறந்தா ரனையர் சினத்தைத் துறந்தார் துறந்தார் துணை
311,1,அறத்துப்பால்,துறவறவியல்,இன்னாசெய்யாமை, சிறப்பீனுஞ் செல்வம் பெறினும் பிறர்க்கின்னா செய்யாமை மாசற்றார் கோள்
312,2,அறத்துப்பால்,துறவறவியல்,இன்னாசெய்யாமை, கறுத்தின்னா செய்தவக் கண்ணும் மறுத்தின்னா செய்யாமை மாசற்றார் கோள்
313,3,அறத்துப்பால்,துறவறவியல்,இன்னாசெய்யாமை, செய்யாமற் செற்றார்க்கும் இன்னாத செய்தபின் உய்யா விழுமந் தரும்
314,4,அறத்துப்பால்,துறவறவியல்,இன்னாசெய்யாமை, இன்னாசெய் தாரை ஒறுத்தல் அவர்நாண நன்னயஞ் செய்து விடல்
315,5,அறத்துப்பால்,துறவறவியல்,இன்னாசெய்யாமை, அறிவினான் ஆகுவ துண்டோ பிறிதின்நோய் தந்நோய்போற் போற்றாக் கடை
316,6,அறத்துப்பால்,துறவறவியல்,இன்னாசெய்யாமை, இன்னா எனத்தா னுணர்ந்தவை துன்னாமை வேண்டும் பிறன்கட் செயல்
317,7,அறத்துப்பால்,துறவறவியல்,இன்னாசெய்யாமை, எனைத்தானும் எஞ்ஞான்றும் யார்க்கும் மனத்தானாம் மாணாசெய் யாமை தலை
318,8,அறத்துப்பால்,துறவறவியல்,இன்னாசெய்யாமை, தன்னுயிர்க் கின்னாமை தானறிவான் என்கொலோ மன்னுயிர்க் கின்னா செயல்
319,9,அறத்துப்பால்,துறவறவியல்,இன்னாசெய்யாமை, பிறர்க்கின்னா முற்பகல் செய்யின் தமக்கின்னா பிற்பகல் தாமே வரும்
320,10,அறத்துப்பால்,துறவறவியல்,இன்னாசெய்யாமை, நோயெல்லா நோய்செய்தார் மேலவா நோய்செய்யார் நோயின்மை வேண்டு பவர்
321,1,அறத்துப்பால்,துறவறவியல்,கொல்லாமை, அறவினை யாதெனின் கொல்லாமை கோறல் பிறவினை எல்லாந் தரும்
322,2,அறத்துப்பால்,துறவறவியல்,கொல்லாமை, பகுத்துணடு பல்லுயி ரோம்புதல் நூலோர் தொகுத்தவற்று ளெல்லாந் தலை
323,3,அறத்துப்பால்,துறவறவியல்,கொல்லாமை, ஒன்றாக நல்லது கொல்லாமை மற்றதன் பின்சாரப் பொய்யாமை நன்று
324,4,அறத்துப்பால்,துறவறவியல்,கொல்லாமை, நல்லா றெனப்படுவ தியாதெனின் யாதொன்றுங் கொல்லாமை சூழும் நெறி
325,5,அறத்துப்பால்,துறவறவியல்,கொல்லாமை, நிலையஞ்சி நீத்தாரு ளெல்லாங் கொலையஞ்சிக் கொல்லாமை சூழ்வான் தலை
326,6,அறத்துப்பால்,துறவறவியல்,கொல்லாமை, கொல்லாமை மேற்கொண் டொழுகுவான் வாழ்நாள்மேல் செல்லா துயிருண்ணுங் கூற்று
327,7,அறத்துப்பால்,துறவறவியல்,கொல்லாமை, தன்னுயிர் நீப்பினுஞ் செய்யற்க தான்பிறி தின்னுயிர் நீக்கும் வினை
328,8,அறத்துப்பால்,துறவறவியல்,கொல்லாமை, நன்றாகும் ஆக்கம் பெரிதெனினுஞ் சான்றோர்க்குக் கொன்றாகும் ஆக்கங் கடை
329,9,அறத்துப்பால்,துறவறவியல்,கொல்லாமை, கொலைவினைய ராகிய மாக்கள் புலைவினையர் புன்மை தெரிவா ரகத்து
330,10,அறத்துப்பால்,துறவறவியல்,கொல்லாமை, உயிருடம்பின் நீக்கியா ரென்ப செயிருடம்பின் செல்லாத்தீ வாழ்க்கை யவர்
331,1,அறத்துப்பால்,துறவறவியல்,நிலையாமை, நில்லாத வற்றை நிலையின என்றுணரும் புல்லறி வாண்மை கடை
332,2,அறத்துப்பால்,துறவறவியல்,நிலையாமை, கூத்தாட் டவைக்குழாத் தற்றே பெருஞ்செல்வம் போக்கும் அருவிளிந் தற்று
333,3,அறத்துப்பால்,துறவறவியல்,நிலையாமை, அற்கா இயல்பிற்றுச் செல்வம் அதுபெற்றால் அற்குப ஆங்கே செயல்
334,4,அறத்துப்பால்,துறவறவியல்,நிலையாமை, நாளென ஒன்றுபோற் காட்டி உயிரீரும் வாள துணர்வார்ப் பெறின்
335,5,அறத்துப்பால்,துறவறவியல்,நிலையாமை, நாச்செற்று விக்குள்மேல் வாராமுன் நல்வினை மேற்சென்று செய்யாப் படும்
336,6,அறத்துப்பால்,துறவறவியல்,நிலையாமை, நெருந லுளனொருவன் இன்றில்லை என்னும் பெருமை யுடைத்திவ் வுலகு
337,7,அறத்துப்பால்,துறவறவியல்,நிலையாமை, ஒருபொழுதும் வாழ்வ தறியார் கருதுப கோடியு மல்ல பல
338,8,அறத்துப்பால்,துறவறவியல்,நிலையாமை, குடம்பை தனித்தொழியப் புள்பறந் தற்றே உடம்போ டுயிரிடை நட்பு
339,9,அறத்துப்பால்,துறவறவியல்,நிலையாமை, உறங்குவது போலுஞ் சாக்கா டுறங்கி விழிப்பது போலும் பிறப்பு
340,10,அறத்துப்பால்,துறவறவியல்,நிலையாமை, புக்கி லமைந்தின்று கொல்லோ உடம்பினுள் துச்சி லிருந்த உயிர்க்கு
341,1,அறத்துப்பால்,துறவறவியல்,துறவு, யாதனின் யாதனின் நீங்கியான் நோதல் அதனின் அதனின் அலன்
342,2,அறத்துப்பால்,துறவறவியல்,துறவு, வேண்டினுண் டாகத் துறக்க துறந்தபின் ஈண்டியற் பால பல
343,3,அறத்துப்பால்,துறவறவியல்,துறவு, அடல்வேண்டும் ஐந்தன் புலத்தை விடல்வேண்டும் வேண்டிய வெல்லாம் ஒருங்கு
344,4,அறத்துப்பால்,துறவறவியல்,துறவு, இயல்பாகும் நோன்பிற்கொன் றின்மை உடைமை மயலாகும் மற்றும் பெயர்த்து
345,5,அறத்துப்பால்,துறவறவியல்,துறவு, மற்றுந் தொடர்ப்பா டெவன்கொல் பிறப்பறுக்கல் உற்றார்க் குடம்பும் மிகை
346,6,அறத்துப்பால்,துறவறவியல்,துறவு, யானென தென்னுஞ் செருக்கறுப்பான் வானோர்க் குயர்ந்த உலகம் புகும்
347,7,அறத்துப்பால்,துறவறவியல்,துறவு, பற்றி விடாஅ இடும்பைகள் பற்றினைப் பற்றி விடாஅ தவர்க்கு
348,8,அறத்துப்பால்,துறவறவியல்,துறவு, தலைப்பட்டார் தீரத் துறந்தார் மயங்கி வலைப்பட்டார் மற்றை யவர்
349,9,அறத்துப்பால்,துறவறவியல்,துறவு, பற்றற்ற கண்ணே பிறப்பறுக்கும் மற்று நிலையாமை காணப் படும்
350,10,அறத்துப்பால்,துறவறவியல்,துறவு, பற்றுக பற்றற்றான் பற்றினை அப்பற்றைப் பற்றுக பற்று விடற்கு
351,1,அறத்துப்பால்,துறவறவியல்,மெய்யுணர்தல், பொருளல்ல வற்றைப் பொருளென் றுணரும் மருளானாம் மாணாப் பிறப்பு
352,2,அறத்துப்பால்,துறவறவியல்,மெய்யுணர்தல், இருள்நீங்கி இன்பம் பயக்கும் மருள்நீங்கி மாசறு காட்சி யவர்க்கு
353,3,அறத்துப்பால்,துறவறவியல்,மெய்யுணர்தல், ஐயத்தின் நீங்கித் தெளிந்தார்க்கு வையத்தின் வான நணிய துடைத்து
354,4,அறத்துப்பால்,துறவறவியல்,மெய்யுணர்தல், ஐயுணர் வெய்தியக் கண்ணும் பயமின்றே மெய்யுணர் வில்லா தவர்க்கு
355,5,அறத்துப்பால்,துறவறவியல்,மெய்யுணர்தல், எப்பொரு ளெத்தன்மைத் தாயினும் அப்பொருள் மெய்ப்பொருள் காண்ப தறிவு
356,6,அறத்துப்பால்,துறவறவியல்,மெய்யுணர்தல், கற்றீண்டு மெய்ப்பொருள் கண்டார் தலைப்படுவர் மற்றீண்டு வாரா நெறி
357,7,அறத்துப்பால்,துறவறவியல்,மெய்யுணர்தல், ஓர்த்துள்ளம் உள்ள துணரின் ஒருதலையாப் பேர்த்துள்ள வேண்டா பிறப்பு
358,8,அறத்துப்பால்,துறவறவியல்,மெய்யுணர்தல், பிறப்பென்னும் பேதைமை நீங்கச் சிறப்பென்னுஞ் செம்பொருள் காண்ப தறிவு
359,9,அறத்துப்பால்,துறவறவியல்,மெய்யுணர்தல், சார்புணர்ந்து சார்பு கெடவொழுகின் மற்றழித்துச் சார்தரா சார்தரு நோய்
360,10,அறத்துப்பால்,துறவறவியல்,மெய்யுணர்தல், காமம் வெகுளி மயக்கம் இவைமூன்றன் நாமங் கெடக்கெடு நோய்
361,1,அறத்துப்பால்,துறவறவியல்,அவாவறுத்தல், அவாவென்ப எல்லா உயிர்க்குமெஞ் ஞான்றுந் தவாஅப் பிறப்பீனும் வித்து
362,2,அறத்துப்பால்,துறவறவியல்,அவாவறுத்தல், வேண்டுங்கால் வேண்டும் பிறவாமை மற்றது வேண்டாமை வேண்ட வரும்
363,3,அறத்துப்பால்,துறவறவியல்,அவாவறுத்தல், வேண்டாமை யன்ன விழுச்செல்வம் ஈண்டில்லை ஆண்டும் அஃதொப்ப தில்
364,4,அறத்துப்பால்,துறவறவியல்,அவாவறுத்தல், தூஉய்மை யென்ப தவாவின்மை மற்றது வாஅய்மை வேண்ட வரும்
365,5,அறத்துப்பால்,துறவறவியல்,அவாவறுத்தல், அற்றவ ரென்பார் அவாவற்றார் மற்றையார் அற்றாக அற்ற திலர்
366,6,அறத்துப்பால்,துறவறவியல்,அவாவறுத்தல், அஞ்சுவ தோரும் அறனே ஒருவனை வஞ்சிப்ப தோரும் அவா
367,7,அறத்துப்பால்,துறவறவியல்,அவாவறுத்தல், அவாவினை ஆற்ற அறுப்பின் தவாவினை தான்வேண்டு மாற்றான் வரும்
368,8,அறத்துப்பால்,துறவறவியல்,அவாவறுத்தல், அவாவில்லார்க் கில்லாகுந் துன்பமஃ துண்டேல் தவாஅது மேன்மேல் வரும்
369,9,அறத்துப்பால்,துறவறவியல்,அவாவறுத்தல், இன்பம் இடையறா தீண்டும் அவாவென்னுந் துன்பத்துள் துன்பங் கெடின்
370,10,அறத்துப்பால்,துறவறவியல்,அவாவறுத்தல், ஆரா இயற்கை அவாநீப்பின் அந்நிலையே பேரா இயற்கை தரும்
371,1,அறத்துப்பால்,ஊழியல்,ஊழ், ஆகூழால் தோன்றும் அசைவின்மை கைப்பொருள் போகூழால் தோன்று மடி
372,2,அறத்துப்பால்,ஊழியல்,ஊழ், பேதைப் படுக்கும் இழவூழ் அறிவகற்றும் ஆகலூ ழுற்றக் கடை
373,3,அறத்துப்பால்,ஊழியல்,ஊழ், நுண்ணிய நூல்பல கற்பினும் மற்றுந்தன் உண்மை யறிவே மிகும்
374,4,அறத்துப்பால்,ஊழியல்,ஊழ், இருவே றுலகத் தியற்கை திருவேறு தெள்ளிய ராதலும் வேறு
375,5,அறத்துப்பால்,ஊழியல்,ஊழ், நல்லவை யெல்லாஅந் தீயவாந் தீயவும் நல்லவாஞ் செல்வஞ் செயற்கு
