1,1,அறத்துப்பால்,பாயிரம் ,கடவுள் வாழ்த்து, அகர முதல எழுத்தெல்லாம் ஆதி  பகவன் முதற்றே உலகு
2,2,அறத்துப்பால்,பாயிரம் ,கடவுள் வாழ்த்து, கற்றதனால் ஆய பயனென்கொல் வாலறிவன் நற்றாள் தொழாஅர் எனின்
3,3,அறத்துப்பால்,பாயிரம் ,கடவுள் வாழ்த்து, மலர்மிசை ஏகினான் மாணடி சேர்ந்தார் நிலமிசை நீடுவாழ் வார்
4,4,அறத்துப்பால்,பாயிரம் ,கடவுள் வாழ்த்து, வேண்டுதல் வேண்டாமை இலானடி சேர்ந்தார்க்கு யாண்டும் இடும்பை இல
5,5,அறத்துப்பால்,பாயிரம் ,கடவுள் வாழ்த்து, இருள்சேர் இருவினையும் சேரா இறைவன் பொருள்சேர் புகழ்புரிந்தார் மாட்டு
6,6,அறத்துப்பால்,பாயிரம் ,கடவுள் வாழ்த்து, பொறிவாயில் ஐந்தவித்தான் பொய்தீர் ஒழுக்க நெறிநின்றார் நீடுவாழ் வார்
7,7,அறத்துப்பால்,பாயிரம் ,கடவுள் வாழ்த்து, தனக்குவமை இல்லாதான் தாள்சேர்ந்தார்க் கல்லால் மனக்கவலை மாற்றல் அரிது
8,8,அறத்துப்பால்,பாயிரம் ,கடவுள் வாழ்த்து, அறவாழி அந்தணன் தாள்சேர்ந்தார்க் கல்லால் பிறவாழி நீந்தல் அரிது
9,9,அறத்துப்பால்,பாயிரம் ,கடவுள் வாழ்த்து, கோளில் பொறியில் குணமிலவே எண்குணத்தான் தாளை வணங்காத் தலை
10,10,அறத்துப்பால்,பாயிரம் ,கடவுள் வாழ்த்து, பிறவிப் பெருங்கடல் நீந்துவர் நீந்தார் இறைவன் அடிசேரா தார்
11,1,அறத்துப்பால்,பாயிரம் ,வான்சிறப்பு, வான்நின் றுலகம் வழங்கி வருதலால் தான்அமிழ்தம் என்றுணரற் பாற்று
12,2,அறத்துப்பால்,பாயிரம் ,வான்சிறப்பு, துப்பார்க்குத் துப்பாய துப்பாக்கித் துப்பார்க்குத் துப்பாய தூஉம் மழை
13,3,அறத்துப்பால்,பாயிரம் ,வான்சிறப்பு, விண்ணின்று பொய்ப்பின் விரிநீர் வியனுலகத் துண்ணின் றுடற்றும் பசி
14,4,அறத்துப்பால்,பாயிரம் ,வான்சிறப்பு, ஏரின் உழாஅர் உழவர் புயல்என்னும் வாரி வளங்குன்றிக் கால்
15,5,அறத்துப்பால்,பாயிரம் ,வான்சிறப்பு, கெடுப்பதூஉம் கெட்டார்க்குச் சார்வாய்மற் றாங்கே எடுப்பதூஉம் எல்லாம் மழை
16,6,அறத்துப்பால்,பாயிரம் ,வான்சிறப்பு, விசும்பின் துளிவீழின் அல்லால்மற் றாங்கே பசும்புல் தலைகாண் பரிது
17,7,அறத்துப்பால்,பாயிரம் ,வான்சிறப்பு, நெடுங்கடலும் தன்நீர்மை குன்றும் தடிந்தெழிலி தான்நல்கா தாகி விடின்
18,8,அறத்துப்பால்,பாயிரம் ,வான்சிறப்பு, சிறப்பொடு பூசனை செல்லாது வானம் வறக்குமேல் வானோர்க்கும் ஈண்டு
19,9,அறத்துப்பால்,பாயிரம் ,வான்சிறப்பு, தானம் தவம்இரண்டும் தங்கா வியன்உலகம் வானம் வழங்கா தெனின்
20,10,அறத்துப்பால்,பாயிரம் ,வான்சிறப்பு, நீரின் றமையா துலகெனின் யார்யார்க்கும் வானின் றமையா தொழுக்கு
21,1,அறத்துப்பால்,பாயிரம் ,நீத்தார் பெருமை, ஒழுக்கத்து நீத்தார் பெருமை விழுப்பத்து வேண்டும் பனுவல் துணிவு
22,2,அறத்துப்பால்,பாயிரம் ,நீத்தார் பெருமை, துறந்தார் பெருமை துணைக்கூறின் வையத் திறந்தாரை எண்ணிக்கொண் டற்று
23,3,அறத்துப்பால்,பாயிரம் ,நீத்தார் பெருமை, இருமை வகைதெரிந்து ஈண்டுஅறம் பூண்டார் பெருமை பிறங்கிற் றுலகு
24,4,அறத்துப்பால்,பாயிரம் ,நீத்தார் பெருமை, உரனென்னும் தோட்டியான் ஓரைந்தும் காப்பான் வரனென்னும் வைப்பிற்கோர் வித்து
25,5,அறத்துப்பால்,பாயிரம் ,நீத்தார் பெருமை, ஐந்தவித்தான் ஆற்றல் அகல்விசும்பு ளார்கோமான் இந்திரனே சாலுங் கரி
26,6,அறத்துப்பால்,பாயிரம் ,நீத்தார் பெருமை, செயற்கரிய செய்வார் பெரியர் சிறியர் செயற்கரிய செய்கலா தார்
27,7,அறத்துப்பால்,பாயிரம் ,நீத்தார் பெருமை, சுவைஒளி ஊறுஓசை நாற்றமென ஐந்தின் வகைதெரிவான் கட்டே உலகு
28,8,அறத்துப்பால்,பாயிரம் ,நீத்தார் பெருமை, நிறைமொழி மாந்தர் பெருமை நிலத்து மறைமொழி காட்டி விடும்
29,9,அறத்துப்பால்,பாயிரம் ,நீத்தார் பெருமை, குணமென்னும் குன்றேறி நின்றார் வெகுளி கணமேயும் காத்தல் அரிது
30,10,அறத்துப்பால்,பாயிரம் ,நீத்தார் பெருமை, அந்தணர் என்போர் அறவோர்மற் றெவ்வுயிர்க்கும் செந்தண்மை பூண்டொழுக லான்
31,1,அறத்துப்பால்,பாயிரம் ,அறன்வலியுறுத்தல், சிறப்பீனும் செல்வமும் ஈனும் அறத்தினூங் காக்கம் எவனோ உயிர்க்கு
32,2,அறத்துப்பால்,பாயிரம் ,அறன்வலியுறுத்தல், அறத்தினூங் காக்கமும் இல்லை அதனை மறத்தலினூங் கில்லையாம் கேடு
33,3,அறத்துப்பால்,பாயிரம் ,அறன்வலியுறுத்தல், ஒல்லும் வகையான் அறவினை ஓவாதே செல்லும்வாய் எல்லாஞ் செயல்
34,4,அறத்துப்பால்,பாயிரம் ,அறன்வலியுறுத்தல், மனத்துக்கண் மாசிலன் ஆதல் அனைத்துஅறன் ஆகுல நீர பிற
35,5,அறத்துப்பால்,பாயிரம் ,அறன்வலியுறுத்தல், அழுக்கா றவாவெகுளி இன்னாச்சொல் நான்கும் இழுக்கா இயன்ற தறம்
36,6,அறத்துப்பால்,பாயிரம் ,அறன்வலியுறுத்தல், அன்றறிவாம் என்னா தறஞ்செய்க மற்றது பொன்றுங்கால் பொன்றாத் துணை
37,7,அறத்துப்பால்,பாயிரம் ,அறன்வலியுறுத்தல், அறத்தா றிதுவென வேண்டா சிவிகை பொறுத்தானோ  டூர்ந்தான் இடை
38,8,அறத்துப்பால்,பாயிரம் ,அறன்வலியுறுத்தல், வீழ்நாள் படாஅமை நன்றாற்றின் அஃதொருவன் வாழ்நாள் வழியடைக்கும் கல்
39,9,அறத்துப்பால்,பாயிரம் ,அறன்வலியுறுத்தல், அறத்தான் வருவதே இன்பமற் றெல்லாம் புறத்த புகழும் இல
40,10,அறத்துப்பால்,பாயிரம் ,அறன்வலியுறுத்தல், செயற்பால தோரும் அறனே ஒருவற் குயற்பால தோரும் பழி
41,1,அறத்துப்பால்,இல்லறவியல்,இல்வாழ்க்கை, இல்வாழ்வான் என்பான் இயல்புடைய மூவர்க்கும் நல்லாற்றின் நின்ற துணை
42,2,அறத்துப்பால்,இல்லறவியல்,இல்வாழ்க்கை, துறந்தார்க்கும் தூவா தவர்க்கும் இறந்தார்க்கும் இல்வாழ்வான் என்பான் துணை
43,3,அறத்துப்பால்,இல்லறவியல்,இல்வாழ்க்கை, தென்புலத்தார் தெய்வம் விருந்தொக்கல் தானென்றாங் கைம்புலத்தார் ஓம்பல் தலை
44,4,அறத்துப்பால்,இல்லறவியல்,இல்வாழ்க்கை, பழியஞ்சிப் பாத்தூண் உடைத்தாயின் வாழ்க்கை வழியெஞ்சல் எஞ்ஞான்றும் இல்
45,5,அறத்துப்பால்,இல்லறவியல்,இல்வாழ்க்கை, அன்பும் அறனும் உடைத்தாயின் இல்வாழ்க்கை பண்பும் பயனும் அது
46,6,அறத்துப்பால்,இல்லறவியல்,இல்வாழ்க்கை, அறத்தாற்றின் இல்வாழ்க்கை ஆற்றின் புறத்தாற்றின் போஒய்ப் பெறுவ தெவன்
47,7,அறத்துப்பால்,இல்லறவியல்,இல்வாழ்க்கை, இயல்பினான் இல்வாழ்க்கை வாழ்பவன் என்பான் முயல்வாருள் எல்லாம் தலை
48,8,அறத்துப்பால்,இல்லறவியல்,இல்வாழ்க்கை, ஆற்றின் ஒழுக்கி அறனிழுக்கா இல்வாழ்க்கை நோற்பாரின் நோன்மை உடைத்து
49,9,அறத்துப்பால்,இல்லறவியல்,இல்வாழ்க்கை, அறன்எனப் பட்டதே இல்வாழ்க்கை அஃதும் பிறன்பழிப்ப தில்லாயின் நன்று
50,10,அறத்துப்பால்,இல்லறவியல்,இல்வாழ்க்கை, வையத்துள் வாழ்வாங்கு வாழ்பவன் வான்உறையும் தெய்வத்துள் வைக்கப் படும்
51,1,அறத்துப்பால்,இல்லறவியல்,வாழ்க்கைத் துணைநலம், மனைக்தக்க மாண்புடையள் ஆகித்தற் கொண்டான் வளத்தக்காள் வாழ்க்கைத் துணை
52,2,அறத்துப்பால்,இல்லறவியல்,வாழ்க்கைத் துணைநலம், மனைமாட்சி இல்லாள்கண் இல்லாயின் வாழ்க்கை எனைமாட்சித் தாயினும் இல்
53,3,அறத்துப்பால்,இல்லறவியல்,வாழ்க்கைத் துணைநலம், இல்லதென் இல்லவள் மாண்பானால் உள்ளதென் இல்லவள் மாணாக் கடை
54,4,அறத்துப்பால்,இல்லறவியல்,வாழ்க்கைத் துணைநலம், பெண்ணின் பெருந்தக்க யாவுள கற்பென்னும் திண்மைஉண் டாகப் பெறின்
55,5,அறத்துப்பால்,இல்லறவியல்,வாழ்க்கைத் துணைநலம், தெய்வம் தொழாஅள் கொழுநன் தொழுதெழுவாள் பெய்யெனப் பெய்யும் மழை
56,6,அறத்துப்பால்,இல்லறவியல்,வாழ்க்கைத் துணைநலம், தற்காத்துத் தற்கொண்டாற் பேணித் தகைசான்ற சொற்காத்துச் சோர்விலாள் பெண்
57,7,அறத்துப்பால்,இல்லறவியல்,வாழ்க்கைத் துணைநலம், சிறைகாக்கும் காப்பெவன் செய்யும் மகளிர் நிறைகாக்கும் காப்பே தலை
58,8,அறத்துப்பால்,இல்லறவியல்,வாழ்க்கைத் துணைநலம், பெற்றாற் பெறின்பெறுவர் பெண்டிர் பெருஞ்சிறப்புப் புத்தேளிர் வாழும் உலகு
59,9,அறத்துப்பால்,இல்லறவியல்,வாழ்க்கைத் துணைநலம், புகழ்புரிந்த இல்லிலோர்க்கு இல்லை இகழ்வார்முன் ஏறுபோல் பீடு நடை
60,10,அறத்துப்பால்,இல்லறவியல்,வாழ்க்கைத் துணைநலம், மங்கலம் என்ப மனைமாட்சி மற்றுஅதன் நன்கலம் நன்மக்கட் பேறு
61,1,அறத்துப்பால்,இல்லறவியல்,புதல்வரைப் பெறுதல், பெறுமவற்றுள் யாமறிவ  தில்லை அறிவுடைய மக்கட்பே றல்ல பிற
62,2,அறத்துப்பால்,இல்லறவியல்,புதல்வரைப் பெறுதல், எழுபிறப்பும் தீயவை தீண்டா பழிபிறங்காப் பண்புடை மக்கட் பெறின்
63,3,அறத்துப்பால்,இல்லறவியல்,புதல்வரைப் பெறுதல், தம்பொருள் என்பதம் மக்கள் அவர்பொருள் தம்தம் வினையான் வரும்
64,4,அறத்துப்பால்,இல்லறவியல்,புதல்வரைப் பெறுதல், அமிழ்தினும் ஆற்ற இனிதேதம் மக்கள் சிறுகை அளாவிய கூழ்
65,5,அறத்துப்பால்,இல்லறவியல்,புதல்வரைப் பெறுதல், மக்கள்மெய் தீண்டல் உடற்கின்பம் மற்றுஅவர் சொற்கேட்டல் இன்பம் செவிக்கு
66,6,அறத்துப்பால்,இல்லறவியல்,புதல்வரைப் பெறுதல்,  குழல்இனிது யாழ்இனிது என்பதம் மக்கள் மழலைச்சொல் கேளா தவர்
67,7,அறத்துப்பால்,இல்லறவியல்,புதல்வரைப் பெறுதல், தந்தை மகற்காற்று நன்றி அவையத்து முந்தி இருப்பச் செயல்
68,8,அறத்துப்பால்,இல்லறவியல்,புதல்வரைப் பெறுதல், தம்மின்தம் மக்கள் அறிவுடைமை மாநிலத்து மன்னுயிர்க் கெல்லாம் இனிது
69,9,அறத்துப்பால்,இல்லறவியல்,புதல்வரைப் பெறுதல், ஈன்ற பொழுதின் பெரிதுவக்கும் தன்மகனைச் சான்றோன் எனக்கேட்ட தாய்
70,10,அறத்துப்பால்,இல்லறவியல்,புதல்வரைப் பெறுதல், மகன்றந்தைக்  காற்று முதவி யிவன்றந்தை என்னோற்றான் கொல்லெனுஞ் சொல்
71,1,அறத்துப்பால்,இல்லறவியல்,அன்புடைமை, அன்பிற்கும் உண்டோ அடைக்குந்தாழ் ஆர்வலர் புன்கணீர் பூசல் தரும்
72,2,அறத்துப்பால்,இல்லறவியல்,அன்புடைமை, அன்பிலார் எல்லாம் தமக்குரியர் அன்புடையார் என்பும் உரியர் பிறர்க்கு
73,3,அறத்துப்பால்,இல்லறவியல்,அன்புடைமை, அன்போ டியைந்த வழக்கென்ப ஆருயிர்க் கென்போ டியைந்த தொடர்பு
74,4,அறத்துப்பால்,இல்லறவியல்,அன்புடைமை, அன்பீனும் ஆர்வம் உடைமை அதுலீனும் நண்புஎன்னும் நாடாச் சிறப்பு
75,5,அறத்துப்பால்,இல்லறவியல்,அன்புடைமை, அன்புற் றமர்ந்த வழக்கென்ப வையகத்து இன்புற்றார் எய்தும் சிறப்பு
76,6,அறத்துப்பால்,இல்லறவியல்,அன்புடைமை, அறத்திற்கே அன்புசார் பென்ப அறியார் மறத்திற்கும் அஃதே துணை
77,7,அறத்துப்பால்,இல்லறவியல்,அன்புடைமை, என்பி லதனை வெயில்போலக் காயுமே அன்பி லதனை அறம்
78,8,அறத்துப்பால்,இல்லறவியல்,அன்புடைமை, அன்பகத் தில்லா உயிர்வாழ்க்கை வன்பாற்கண் வற்றல் மரந்தளிர்த் தற்று
79,9,அறத்துப்பால்,இல்லறவியல்,அன்புடைமை, புறத்துறுப் பெல்லாம் எவன்செய்யும் யாக்கை அகத்துறுப்பு அன்பி லவர்க்கு
80,10,அறத்துப்பால்,இல்லறவியல்,அன்புடைமை, அன்பின் வழியது உயிர்நிலை அஃதிலார்க்கு என்புதோல் போர்த்த உடம்பு
81,1,அறத்துப்பால்,இல்லறவியல்,விருந்தோம்பல், இருந்தோம்பி இல்வாழ்வ தெல்லாம் விருந்தோம்பி வேளாண்மை செய்தற் பொருட்டு
82,2,அறத்துப்பால்,இல்லறவியல்,விருந்தோம்பல், விருந்து புறத்ததாத் தானுண்டல் சாவா மருந்தெனினும் வேண்டற்பாற் றன்று
83,3,அறத்துப்பால்,இல்லறவியல்,விருந்தோம்பல், வருவிருந்து வைகலும் ஓம்புவான் வாழ்க்கை பருவந்து பாழ்படுதல் இன்று
84,4,அறத்துப்பால்,இல்லறவியல்,விருந்தோம்பல், அகனமர்ந்து செய்யாள் உறையும் முகனமர்ந்து நல்விருந்து ஓம்புவான் இல்
85,5,அறத்துப்பால்,இல்லறவியல்,விருந்தோம்பல், வித்தும் இடல்வேண்டும் கொல்லோ விருந்தோம்பி மிச்சில் மிசைவான் புலம்
86,6,அறத்துப்பால்,இல்லறவியல்,விருந்தோம்பல், செல்விருந்து ஓம்பி வருவிருந்து பார்த்திருப்பான் நல்வருந்து வானத் தவர்க்கு
87,7,அறத்துப்பால்,இல்லறவியல்,விருந்தோம்பல், இனைத்துணைத் தென்பதொன் றில்லை விருந்தின் துணைத்துணை வேள்விப் பயன்
88,8,அறத்துப்பால்,இல்லறவியல்,விருந்தோம்பல், பரிந்தோம்பிப் பற்றற்றேம் என்பர் விருந்தோம்பி வேள்வி தலைப்படா தார்
89,9,அறத்துப்பால்,இல்லறவியல்,விருந்தோம்பல், உடைமையுள் இன்மை விருந்தோம்பல் ஓம்பா மடமை மடவார்கண் உண்டு
90,10,அறத்துப்பால்,இல்லறவியல்,விருந்தோம்பல், மோப்பக் குழையும் அனிச்சம் முகந்திரிந்து நோக்கக் குழையும் விருந்து
91,1,அறத்துப்பால்,இல்லறவியல்,இனியவைகூறல்,  இன்சொலா லீர மளைஇப் படிறிலவாஞ் செம்பொருள் கண்டார்வாய்ச் சொல்
